{
  "meta": {
    "briefVersionId": "bv-0f2a91c4-en-1",
    "briefId": "br-8c31a0de",
    "campaignId": "cmp-2026-tcl-qled-c755",
    "language": "en",
    "version": 1,
    "parentVersionId": null,
    "translationOfId": "bv-0f2a91c4-es-3",
    "status": "internal_review",
    "createdBy": "usr-gcalambas",
    "createdAt": "2026-08-11T15:40:00-05:00",
    "templateVersion": "brief-maestro-v1"
  },

  "contexto": {
    "situacion": {
      "value": "TCL enters the Colombian year-end season with the QLED C755 as its flagship gaming reference. The premium TV category is dominated by Samsung and LG in mind share, and Colombian consumers associate 'gaming TV' with Korean brands. TCL offers a better price-to-spec ratio but low consideration in the segment.",
      "status": "found",
      "confidence": 0.88,
      "provenanceType": "translated",
      "criticidad": "critico",
      "evidence": [
        {
          "sourceId": "src-ppt-global-c755",
          "fragmentId": "frg-0031",
          "page": null,
          "slide": 4,
          "quote": "Q4 flagship gaming positioning — C755 series, price-to-spec leadership vs. Korean competitors",
          "relation": "soporta"
        },
        {
          "sourceId": "src-brief-cliente-co",
          "fragmentId": "frg-0118",
          "page": 1,
          "slide": null,
          "quote": "Necesitamos ganar consideración en el segmento gaming, hoy dominado por Samsung y LG.",
          "relation": "soporta"
        }
      ]
    },
    "categoria": {
      "value": "Premium QLED televisions — gaming segment",
      "status": "found",
      "confidence": 0.95,
      "provenanceType": "translated",
      "criticidad": "informativo",
      "evidence": [
        {
          "sourceId": "src-ficha-tecnica-c755",
          "fragmentId": "frg-0002",
          "page": 1,
          "slide": null,
          "quote": "TCL C755 QLED Gaming TV Series",
          "relation": "soporta"
        }
      ]
    },
    "contexto_global": {
      "value": "Global material positions the C755 series as a gaming reference focused on 144Hz and next-gen console compatibility. The global narrative is 'Play Beyond Limits'.",
      "status": "found",
      "confidence": 0.91,
      "provenanceType": "translated",
      "criticidad": "informativo",
      "evidence": [
        {
          "sourceId": "src-ppt-global-c755",
          "fragmentId": "frg-0009",
          "page": null,
          "slide": 2,
          "quote": "Global campaign narrative: Play Beyond Limits",
          "relation": "soporta"
        }
      ]
    }
  },

  "objetivo": {
    "tipo": {
      "value": "consideration",
      "status": "found",
      "confidence": 0.84,
      "provenanceType": "translated",
      "criticidad": "critico",
      "evidence": [
        {
          "sourceId": "src-brief-cliente-co",
          "fragmentId": "frg-0120",
          "page": 1,
          "slide": null,
          "quote": "Objetivo: generar interés y consideración en gamers que hoy no evalúan TCL.",
          "relation": "soporta"
        }
      ]
    },
    "negocio": {
      "value": "Increase TCL's share of the premium TV category in Colombia during Q4, leveraging the year-end season.",
      "status": "found",
      "confidence": 0.79,
      "provenanceType": "translated",
      "criticidad": "critico",
      "evidence": [
        {
          "sourceId": "src-brief-cliente-co",
          "fragmentId": "frg-0121",
          "page": 1,
          "slide": null,
          "quote": "Crecer participación en TV premium en Q4 aprovechando temporada.",
          "relation": "soporta"
        }
      ]
    },
    "marca_comunicacion": {
      "value": "Establish TCL as a legitimate and desirable option for demanding gamers, not as the budget alternative.",
      "status": "manual",
      "confidence": null,
      "provenanceType": "translated",
      "criticidad": "informativo",
      "evidence": []
    },
    "comportamiento_esperado": {
      "value": "Get gamers to include the C755 in their comparison before deciding on a purchase.",
      "status": "manual",
      "confidence": null,
      "provenanceType": "translated",
      "criticidad": "informativo",
      "evidence": []
    }
  },

  "target_audiencia": {
    "descripcion": {
      "value": "Console and PC gamers, men and women aged 22 to 38, urban, socioeconomic strata 4-6, who research specifications before buying and consume reviews on YouTube and TikTok.",
      "status": "found",
      "confidence": 0.82,
      "provenanceType": "translated",
      "criticidad": "critico",
      "evidence": [
        {
          "sourceId": "src-brief-cliente-co",
          "fragmentId": "frg-0124",
          "page": 2,
          "slide": null,
          "quote": "Gamers 22-38, urbanos, estratos 4 a 6, altamente informados sobre specs.",
          "relation": "soporta"
        }
      ]
    },
    "rango_edad": {
      "value": "22–38 years old",
      "status": "found",
      "confidence": 0.93,
      "provenanceType": "translated",
      "criticidad": "informativo",
      "evidence": [
        {
          "sourceId": "src-brief-cliente-co",
          "fragmentId": "frg-0124",
          "page": 2,
          "slide": null,
          "quote": "Gamers 22-38",
          "relation": "soporta"
        }
      ]
    },
    "ubicacion": {
      "value": ["Bogotá", "Medellín", "Cali", "Barranquilla"],
      "status": "found",
      "confidence": 0.9,
      "provenanceType": "translated",
      "criticidad": "informativo",
      "evidence": [
        {
          "sourceId": "src-brief-cliente-co",
          "fragmentId": "frg-0125",
          "page": 2,
          "slide": null,
          "quote": "Ciudades prioritarias: Bogotá, Medellín, Cali y Barranquilla.",
          "relation": "soporta"
        }
      ]
    },
    "comportamiento": {
      "value": "Compares technical specifications before buying; trusts niche creators more than brand advertising.",
      "status": "manual",
      "confidence": null,
      "provenanceType": "translated",
      "criticidad": "informativo",
      "evidence": []
    },
    "relacion_categoria": {
      "value": null,
      "status": "not_found",
      "confidence": null,
      "provenanceType": "translated",
      "criticidad": "informativo",
      "evidence": []
    }
  },

  "problema_insight": {
    "problema": {
      "value": "We need Colombian gamers to consider TCL, because today the brand does not make their shortlist even though the product competes on specifications.",
      "status": "manual",
      "confidence": null,
      "provenanceType": "translated",
      "criticidad": "informativo",
      "evidence": []
    },
    "tension": {
      "value": "I want the best TV for gaming, but I assume the brand I know is the one that performs best.",
      "status": "manual",
      "confidence": null,
      "provenanceType": "translated",
      "criticidad": "informativo",
      "evidence": []
    },
    "insight": {
      "value": null,
      "status": "not_found",
      "confidence": null,
      "provenanceType": "translated",
      "criticidad": "informativo",
      "evidence": []
    },
    "cambio_comportamiento": {
      "value": "Get gamers to check the spec sheet before assuming which brand performs better.",
      "status": "manual",
      "confidence": null,
      "provenanceType": "translated",
      "criticidad": "informativo",
      "evidence": []
    }
  },

  "marca_producto": {
    "productId": {
      "value": "prd-tcl-c755-55",
      "status": "manual",
      "confidence": null,
      "provenanceType": "translated",
      "criticidad": "informativo",
      "evidence": []
    },
    "nombre_producto": {
      "value": "TCL QLED C755 — 55\"",
      "status": "found",
      "confidence": 0.97,
      "provenanceType": "translated",
      "criticidad": "critico",
      "evidence": [
        {
          "sourceId": "src-ficha-tecnica-c755",
          "fragmentId": "frg-0001",
          "page": 1,
          "slide": null,
          "quote": "TCL C755 QLED 55\" (55C755)",
          "relation": "soporta"
        }
      ]
    },
    "rol_marca": {
      "value": "Informed challenger: the brand that wins when the consumer compares with data.",
      "status": "manual",
      "confidence": null,
      "provenanceType": "translated",
      "criticidad": "informativo",
      "evidence": []
    },
    "beneficio_principal": {
      "value": "144Hz QLED panel with Game Master, built for next-gen consoles.",
      "status": "found",
      "confidence": 0.94,
      "provenanceType": "translated",
      "criticidad": "claim",
      "evidence": [
        {
          "sourceId": "src-ficha-tecnica-c755",
          "fragmentId": "frg-0014",
          "page": 2,
          "slide": null,
          "quote": "Native 144Hz VRR panel with Game Master 3.0",
          "relation": "soporta"
        }
      ]
    },
    "diferenciales": {
      "value": [
        "Native 144Hz refresh rate",
        "VRR and ALLM compatibility",
        "Mini LED backlight"
      ],
      "status": "found",
      "confidence": 0.89,
      "provenanceType": "translated",
      "criticidad": "claim",
      "evidence": [
        {
          "sourceId": "src-ficha-tecnica-c755",
          "fragmentId": "frg-0014",
          "page": 2,
          "slide": null,
          "quote": "Native 144Hz VRR panel with Game Master 3.0",
          "relation": "soporta"
        },
        {
          "sourceId": "src-ficha-tecnica-c755",
          "fragmentId": "frg-0016",
          "page": 2,
          "slide": null,
          "quote": "Mini LED backlight, ALLM supported",
          "relation": "soporta"
        }
      ]
    },
    "rtbs": {
      "value": [
        "The spec sheet certifies a native 144Hz panel, not interpolated",
        "Mini LED delivers finer contrast zone control than conventional LED"
      ],
      "status": "found",
      "confidence": 0.86,
      "provenanceType": "translated",